[{"commit":"737296c5e378c33ac823af8404f87ebac0eb2fad","content_sha256":"ac367668690c734480b995e2d9f6279f1f3e24a8154aaeb752c03d55d6461162","crate":"json","origin":"https://github.com/mosteo/onox-json-ada","source_kind":"git","version":"6.0.0"},{"commit":"73c2cd73e440b1e36d1b5c8b741fcb0e3fc4046c","content_sha256":"f52c14be55262ca2e1b3a0678ee4dc9390cdb535b73f3766bd7af749cf50cf7a","crate":"sha2","origin":"https://github.com/AntonMeep/sha2.git","source_kind":"git","version":"2.0.0"}]
